{
  "$schema": "warrant://change-record/1",
  "change": "lattice-issues",
  "change_state": "VERIFYING",
  "classification": {
    "profiles": [
      "chore",
      "factory-change"
    ]
  },
  "transitions": [
    {
      "to": "PROPOSED",
      "at": "2026-09-28T21:25:42.745Z",
      "by": "cli:local"
    },
    {
      "to": "SPECIFIED",
      "at": "2026-09-28T21:44:59.769Z",
      "by": "cli:local",
      "effective_policy_hash": "sha256:6ea1c035ed7a91b1b352c085cf482f464b11bbe388478304723cc7a9c88bcc03",
      "gates": {
        "ids-valid": "PASS",
        "required-artifacts-present": "PASS",
        "spec-valid": "PASS"
      },
      "evidence": [
        "EVID-01M3MZMR6XFNM8VTEWZNP48JN3"
      ]
    },
    {
      "to": "APPROVED",
      "at": "2026-09-28T21:55:10.739Z",
      "by": "cli:local",
      "effective_policy_hash": "sha256:6ea1c035ed7a91b1b352c085cf482f464b11bbe388478304723cc7a9c88bcc03",
      "gates": {
        "adversarial-review": "PASS",
        "blocking-unknowns-resolved": "PASS",
        "human-approval": "PASS",
        "ids-valid": "PASS",
        "required-artifacts-present": "PASS",
        "spec-valid": "PASS"
      },
      "evidence": [
        "EVID-01M3MZHGZ92Q04VA26FHB708AG",
        "EVID-01M3N071E64S69PAGVSYG1DSBD",
        "EVID-01M3N07CTKY95JY9BXGZ08QYSA"
      ],
      "ref": "https://github.com/Homasters-max/SRA/pull/91"
    },
    {
      "to": "IMPLEMENTING",
      "at": "2026-09-28T21:55:13.293Z",
      "by": "cli:local",
      "effective_policy_hash": "sha256:6ea1c035ed7a91b1b352c085cf482f464b11bbe388478304723cc7a9c88bcc03",
      "gates": {
        "branch-isolated": "PASS"
      },
      "evidence": []
    },
    {
      "to": "VERIFYING",
      "at": "2026-09-29T07:47:58.025Z",
      "by": "cli:local",
      "effective_policy_hash": "sha256:6ea1c035ed7a91b1b352c085cf482f464b11bbe388478304723cc7a9c88bcc03",
      "gates": {},
      "evidence": []
    }
  ]
}
