{
  "$schema": "warrant://change-record/1",
  "change": "phase-4b",
  "change_state": "MERGED",
  "classification": {
    "profiles": [
      "chore",
      "factory-change"
    ],
    "risk": {
      "blast_radius": {
        "value": "SYSTEM",
        "from": "floor:core-sdd:2"
      }
    }
  },
  "transitions": [
    {
      "to": "PROPOSED",
      "at": "2026-09-25T17:28:38.196Z",
      "by": "cli:local"
    },
    {
      "to": "SPECIFIED",
      "at": "2026-09-25T18:01:29.264Z",
      "by": "cli:local",
      "effective_policy_hash": "sha256:0975648ef97c5f46279e163d015f5e4df38196ffc5d5ec45f2f0ca4141590829",
      "gates": {
        "ids-valid": "PASS",
        "required-artifacts-present": "PASS",
        "spec-valid": "PASS"
      },
      "evidence": [
        "EVID-01M3CVNB5TRRR7QREGD90SF1JA"
      ]
    },
    {
      "to": "APPROVED",
      "at": "2026-09-25T18:49:44.524Z",
      "by": "cli:local",
      "effective_policy_hash": "sha256:0975648ef97c5f46279e163d015f5e4df38196ffc5d5ec45f2f0ca4141590829",
      "gates": {
        "adversarial-review": "WAIVED",
        "blocking-unknowns-resolved": "PASS",
        "human-approval": "PASS",
        "ids-valid": "PASS",
        "required-artifacts-present": "PASS",
        "spec-valid": "PASS"
      },
      "evidence": [
        "EVID-01M3CYCZZ81YE3MJH797Y9S3BT",
        "EVID-01M3CYDPMA4VKBFZR0PE624XRD"
      ],
      "ref": "https://github.com/Homasters-max/SRA/pull/51"
    },
    {
      "to": "IMPLEMENTING",
      "at": "2026-09-25T18:49:46.997Z",
      "by": "cli:local",
      "effective_policy_hash": "sha256:0975648ef97c5f46279e163d015f5e4df38196ffc5d5ec45f2f0ca4141590829",
      "gates": {
        "branch-isolated": "PASS"
      },
      "evidence": []
    },
    {
      "to": "VERIFYING",
      "at": "2026-09-25T23:32:40.285Z",
      "by": "cli:local",
      "effective_policy_hash": "sha256:0975648ef97c5f46279e163d015f5e4df38196ffc5d5ec45f2f0ca4141590829",
      "gates": {},
      "evidence": []
    },
    {
      "to": "MERGED",
      "at": "2026-09-26T00:34:54.154Z",
      "by": "cli:local",
      "effective_policy_hash": "sha256:0975648ef97c5f46279e163d015f5e4df38196ffc5d5ec45f2f0ca4141590829",
      "gates": {
        "analyze-clean": "PASS",
        "evidence-complete": "PASS",
        "factory-golden-passed": "PASS",
        "human-approval": "PASS",
        "ids-valid": "PASS",
        "scope-valid": "PASS",
        "spec-approved": "PASS",
        "tests-passed": "PASS"
      },
      "evidence": [
        "EVID-01M3DGFCBK3ZA16E92DNS3DD12",
        "EVID-01M3DJ5S2TBRPBR02B600J4589"
      ],
      "ref": "https://github.com/Homasters-max/SRA/actions/runs/36203233664"
    }
  ]
}
