{
  "$schema": "warrant://change-record/1",
  "change": "test-levels",
  "change_state": "MERGED",
  "classification": {
    "profiles": [
      "chore",
      "factory-change"
    ],
    "risk": {
      "blast_radius": {
        "value": "SYSTEM",
        "from": "floor:core-sdd:2"
      }
    }
  },
  "transitions": [
    {
      "to": "PROPOSED",
      "at": "2026-09-23T21:37:55.313Z",
      "by": "cli:local"
    },
    {
      "to": "SPECIFIED",
      "at": "2026-09-23T23:06:45.125Z",
      "by": "cli:local",
      "effective_policy_hash": "sha256:0975648ef97c5f46279e163d015f5e4df38196ffc5d5ec45f2f0ca4141590829",
      "gates": {
        "ids-valid": "PASS",
        "required-artifacts-present": "PASS",
        "spec-valid": "PASS"
      },
      "evidence": [
        "EVID-01M388AMH4Z5T5HN1KZZ95F5C0"
      ]
    },
    {
      "to": "APPROVED",
      "at": "2026-09-23T23:08:50.617Z",
      "by": "cli:local",
      "effective_policy_hash": "sha256:0975648ef97c5f46279e163d015f5e4df38196ffc5d5ec45f2f0ca4141590829",
      "gates": {
        "adversarial-review": "WAIVED",
        "blocking-unknowns-resolved": "PASS",
        "human-approval": "PASS",
        "ids-valid": "PASS",
        "required-artifacts-present": "PASS",
        "spec-valid": "PASS"
      },
      "evidence": [
        "EVID-01M388EFBMC76Q6QN1VE379G6Y",
        "EVID-01M388EQMXH4RYJJS1XYA9VY0Z"
      ],
      "ref": "https://github.com/Homasters-max/SRA/pull/14"
    },
    {
      "to": "IMPLEMENTING",
      "at": "2026-09-23T23:08:53.476Z",
      "by": "cli:local",
      "effective_policy_hash": "sha256:0975648ef97c5f46279e163d015f5e4df38196ffc5d5ec45f2f0ca4141590829",
      "gates": {
        "branch-isolated": "PASS"
      },
      "evidence": []
    },
    {
      "to": "VERIFYING",
      "at": "2026-09-24T03:14:51.440Z",
      "by": "cli:local",
      "effective_policy_hash": "sha256:0975648ef97c5f46279e163d015f5e4df38196ffc5d5ec45f2f0ca4141590829",
      "gates": {},
      "evidence": []
    },
    {
      "to": "MERGED",
      "at": "2026-09-24T14:13:20.026Z",
      "by": "cli:local",
      "effective_policy_hash": "sha256:0975648ef97c5f46279e163d015f5e4df38196ffc5d5ec45f2f0ca4141590829",
      "gates": {
        "analyze-clean": "WAIVED",
        "evidence-complete": "PASS",
        "factory-golden-passed": "PASS",
        "human-approval": "PASS",
        "ids-valid": "PASS",
        "scope-valid": "PASS",
        "spec-approved": "PASS",
        "tests-passed": "PASS"
      },
      "evidence": [
        "EVID-01M38PPSWDXMZFC5ZAFJWZRGRK",
        "EVID-01M39W6MHP3BNYEX6ARFQTM386"
      ],
      "ref": "https://github.com/Homasters-max/SRA/actions/runs/35950663998"
    }
  ]
}
