{
  "$schema": "warrant://change-record/1",
  "change": "data-paths",
  "change_state": "ARCHIVED",
  "classification": {
    "profiles": [
      "chore",
      "factory-change",
      "human-acceptance"
    ]
  },
  "transitions": [
    {
      "to": "PROPOSED",
      "at": "2026-10-02T19:23:40.723Z",
      "by": "cli:local"
    },
    {
      "to": "SPECIFIED",
      "at": "2026-10-02T19:45:37.426Z",
      "by": "cli:local",
      "effective_policy_hash": "sha256:01aac965af7230f9437fe737882f57fb9cac7113343c461db59a7b0ab4c9d15b",
      "gates": {
        "ids-valid": "PASS",
        "required-artifacts-present": "PASS",
        "spec-valid": "PASS"
      },
      "evidence": [
        "EVID-01M3Z2CYKP7ZT64A38DW33XHVV"
      ]
    },
    {
      "to": "APPROVED",
      "at": "2026-10-02T19:58:58.270Z",
      "by": "cli:local",
      "effective_policy_hash": "sha256:01aac965af7230f9437fe737882f57fb9cac7113343c461db59a7b0ab4c9d15b",
      "gates": {
        "adversarial-review": "PASS",
        "blocking-unknowns-resolved": "PASS",
        "human-approval": "PASS",
        "ids-valid": "PASS",
        "required-artifacts-present": "PASS",
        "spec-valid": "PASS"
      },
      "evidence": [
        "EVID-01M3Z2A0B5GE0AKC4S3TGW62T9",
        "EVID-01M3Z350VY1JA1Q781GPB6ARKF",
        "EVID-01M3Z35CRWEY5P0XVPJMVJP465"
      ],
      "ref": "https://github.com/Homasters-max/SRA/pull/163"
    },
    {
      "to": "IMPLEMENTING",
      "at": "2026-10-02T19:59:02.368Z",
      "by": "cli:local",
      "effective_policy_hash": "sha256:01aac965af7230f9437fe737882f57fb9cac7113343c461db59a7b0ab4c9d15b",
      "gates": {
        "branch-isolated": "PASS"
      },
      "evidence": []
    },
    {
      "to": "VERIFYING",
      "at": "2026-10-02T20:44:21.300Z",
      "by": "cli:local",
      "effective_policy_hash": "sha256:01aac965af7230f9437fe737882f57fb9cac7113343c461db59a7b0ab4c9d15b",
      "gates": {},
      "evidence": []
    },
    {
      "to": "IMPLEMENTING",
      "at": "2026-10-02T21:03:17.568Z",
      "by": "cli:local"
    },
    {
      "to": "VERIFYING",
      "at": "2026-10-02T21:04:20.786Z",
      "by": "cli:local",
      "effective_policy_hash": "sha256:01aac965af7230f9437fe737882f57fb9cac7113343c461db59a7b0ab4c9d15b",
      "gates": {},
      "evidence": []
    },
    {
      "to": "MERGED",
      "at": "2026-10-02T21:29:15.203Z",
      "by": "cli:local",
      "effective_policy_hash": "sha256:01aac965af7230f9437fe737882f57fb9cac7113343c461db59a7b0ab4c9d15b",
      "gates": {
        "analyze-clean": "PASS",
        "evidence-complete": "PASS",
        "factory-golden-passed": "PASS",
        "human-approval": "PASS",
        "ids-valid": "PASS",
        "scope-valid": "PASS",
        "spec-approved": "WAIVED",
        "tests-passed": "PASS"
      },
      "evidence": [
        "EVID-01M3Z81KQWJHBAX156845R4XRS",
        "EVID-01M3Z8ATKTXEZV4RPP3X5P2Y4Z"
      ],
      "ref": "https://github.com/Homasters-max/SRA/pull/164"
    },
    {
      "to": "ARCHIVED",
      "at": "2026-10-02T21:29:21.664Z",
      "by": "cli:local",
      "effective_policy_hash": "sha256:01aac965af7230f9437fe737882f57fb9cac7113343c461db59a7b0ab4c9d15b",
      "gates": {
        "analyze-clean": "PASS",
        "ids-valid": "PASS",
        "required-artifacts-present": "PASS",
        "spec-valid": "PASS"
      },
      "evidence": [
        "EVID-01M3Z8B0ATBJZ8SE3FGQS01XCY"
      ]
    }
  ]
}
