{
  "$schema": "warrant://change-record/1",
  "change": "phase-3-verification",
  "change_state": "SPECIFIED",
  "classification": {
    "profiles": [
      "chore",
      "factory-change"
    ],
    "risk": {
      "blast_radius": {
        "value": "SYSTEM",
        "from": "floor:core-sdd:2"
      }
    }
  },
  "transitions": [
    {
      "to": "PROPOSED",
      "at": "2026-09-22T18:48:30.580Z",
      "by": "cli:local"
    },
    {
      "to": "SPECIFIED",
      "at": "2026-09-23T14:42:14.339Z",
      "by": "cli:local",
      "effective_policy_hash": "sha256:af9374fea32ab0fa81f8b3562f57b3d56eeb69c8d6b2a8161ee7f08a78fad6c1",
      "gates": {
        "ids-valid": "PASS",
        "required-artifacts-present": "PASS",
        "spec-valid": "PASS"
      },
      "evidence": [
        "EVID-01M37BF0T058BDC4ZQPFXF5FYZ"
      ]
    }
  ]
}
