{
  "$schema": "warrant://change-record/1",
  "change": "lattice-fixes",
  "change_state": "PROPOSED",
  "classification": {
    "profiles": [
      "chore",
      "factory-change"
    ],
    "risk": {
      "blast_radius": {
        "value": "SYSTEM",
        "from": "floor:core-sdd:2"
      }
    }
  },
  "transitions": [
    {
      "to": "PROPOSED",
      "at": "2026-09-27T23:47:36.728Z",
      "by": "cli:local"
    }
  ]
}
