{
  "$schema": "warrant://change-record/1",
  "change": "feature",
  "change_state": "PROPOSED",
  "classification": {
    "profiles": [
      "feature"
    ],
    "risk": {
      "data_loss": {
        "value": "NONE",
        "from": "proposer:golden"
      },
      "reversibility": {
        "value": "MODERATE",
        "from": "proposer:golden"
      },
      "blast_radius": {
        "value": "COMPONENT",
        "from": "proposer:golden"
      },
      "security_impact": {
        "value": "LOW",
        "from": "proposer:golden"
      },
      "compatibility": {
        "value": "COMPATIBLE",
        "from": "proposer:golden"
      }
    }
  },
  "transitions": [
    {
      "to": "PROPOSED",
      "at": "2026-09-22T00:00:00Z",
      "by": "cli:local"
    }
  ]
}
