{
  "$schema": "warrant://change-record/1",
  "change": "identities",
  "change_state": "MERGED",
  "classification": {
    "profiles": [
      "chore",
      "factory-change"
    ],
    "risk": {
      "blast_radius": {
        "value": "SYSTEM",
        "from": "floor:core-sdd:2"
      }
    }
  },
  "transitions": [
    {
      "to": "PROPOSED",
      "at": "2026-09-29T17:55:49.091Z",
      "by": "cli:local"
    },
    {
      "to": "SPECIFIED",
      "at": "2026-09-29T18:05:25.599Z",
      "by": "cli:local",
      "effective_policy_hash": "sha256:0975648ef97c5f46279e163d015f5e4df38196ffc5d5ec45f2f0ca4141590829",
      "gates": {
        "ids-valid": "PASS",
        "required-artifacts-present": "PASS",
        "spec-valid": "PASS"
      },
      "evidence": [
        "EVID-01M3Q5FBGQZWX0ZABA4NKY0GF5"
      ]
    },
    {
      "to": "APPROVED",
      "at": "2026-09-29T22:19:10.152Z",
      "by": "cli:local",
      "effective_policy_hash": "sha256:0975648ef97c5f46279e163d015f5e4df38196ffc5d5ec45f2f0ca4141590829",
      "gates": {
        "adversarial-review": "PASS",
        "blocking-unknowns-resolved": "PASS",
        "human-approval": "PASS",
        "ids-valid": "PASS",
        "required-artifacts-present": "PASS",
        "spec-valid": "PASS"
      },
      "evidence": [
        "EVID-01M3Q5E0C0YJ67M9ZFQ3C7A3B0",
        "EVID-01M3QC9YQ5W3V9ZYT5GCTDF06K",
        "EVID-01M3QKZY8NBX4PP784F17DMTNN"
      ],
      "ref": "https://github.com/Homasters-max/SRA/pull/106"
    },
    {
      "to": "IMPLEMENTING",
      "at": "2026-09-29T22:20:49.653Z",
      "by": "cli:local",
      "effective_policy_hash": "sha256:0975648ef97c5f46279e163d015f5e4df38196ffc5d5ec45f2f0ca4141590829",
      "gates": {
        "branch-isolated": "PASS"
      },
      "evidence": []
    },
    {
      "to": "VERIFYING",
      "at": "2026-09-29T22:26:53.106Z",
      "by": "cli:local",
      "effective_policy_hash": "sha256:0975648ef97c5f46279e163d015f5e4df38196ffc5d5ec45f2f0ca4141590829",
      "gates": {},
      "evidence": []
    },
    {
      "to": "IMPLEMENTING",
      "at": "2026-09-29T22:41:29.102Z",
      "by": "cli:local"
    },
    {
      "to": "VERIFYING",
      "at": "2026-09-29T22:41:36.522Z",
      "by": "cli:local",
      "effective_policy_hash": "sha256:0975648ef97c5f46279e163d015f5e4df38196ffc5d5ec45f2f0ca4141590829",
      "gates": {},
      "evidence": []
    },
    {
      "to": "MERGED",
      "at": "2026-09-29T22:49:03.357Z",
      "by": "cli:local",
      "effective_policy_hash": "sha256:0975648ef97c5f46279e163d015f5e4df38196ffc5d5ec45f2f0ca4141590829",
      "gates": {
        "analyze-clean": "PASS",
        "evidence-complete": "PASS",
        "factory-golden-passed": "PASS",
        "human-approval": "PASS",
        "ids-valid": "PASS",
        "scope-valid": "PASS",
        "spec-approved": "PASS",
        "tests-passed": "PASS"
      },
      "evidence": [
        "EVID-01M3QNGW8XZ4JKG5YSTDKYG3C8",
        "EVID-01M3QNPSAQNSXB7WX3K0F9N7F3"
      ],
      "ref": "https://github.com/Homasters-max/SRA/pull/114"
    }
  ]
}
